TX,4.42,0,3.82,0,3.96,0,,Keller Williams Realty International,2020,,2015,,808385,TX,Travis,-97.76570129,78703,http://photos.listhub.net/KW/10976541/1?lm=20200404T123855,http://photos.listhub.net/KW/10976541/1?lm=20200404T123855,100,100,.,18000,2497241,-0.476752,3062.39,5491.22,0.84449,0.84449,-0.476752,4,views,15,United States,,Austin,913000,68.55,30.27625,"Old West Austin blends splendid&nbsp;charm with laid-back nightlife. This nearly-Downtown neighborhood&rsquo;s historic homes and independent restaurants, record stores,art galleries and blues bars reward those who explore its upscale community. Bordering the lake and only minutes away from 6th Street&#39;s famous entertainment, Old West Austin offers a winning combination of natural beauty and big-city urbanity allowing it to stand out in the real estate market.The neighborhood was recently named one of ten Great American Neighborhoods by the American Planning Association,and&nbsp;is a highly sought-after community in Austin. In 2003, the Old West Austin neighborhood was placed on the National Register of Historic Places for its significance in the city&rsquo;s exciting history as the area is noted for approximately 1,574 historically significant properties within its borders.&nbsp;<br />&nbsp;","$913,000 ",FALSE,68.55,Old West Austin,274900,TX,-97.760908,87,62,5,Single Family Residential,Residential,Single Family Detached,3,,,Active,Austin,MLS Listing,30.28059959,"Austin&apos;s premier design-build firm, Joseph Design Build presents 812 Theresa. Modern design and first rate construction in Clarksville. Features include Pool,large Anderson windows, open floor plan, master suite with huge closet, and garden tub, large 3rd floor den w/full bath, upgraded sound insulation, and a fully fenced front yard. Professionally curated finishes include oak floors, custom cabinets, Quartzite countertops, and much more. Call for virtual or private tour.",,,"Single Family Detached, Other - Austin, TX",,,,Garage,812 Theresa AVE #1,,,Keller Williams Realty International,(512) 448-4111,http://www.kwaustin.com/,https://listings.listhub.net/pages/KW/10976541/?channel=mashv,4,TRUE,Old West Austin,,1299000,644.6650124,,0,,,FALSE,2020-04-03T00:00:00.000Z,Central Furnace,Central A/C,"Keller Williams Realty, Inc.",,0,14.81,,,,Other,TRUE,,0,0,0,Elementary,Mathews,,High,Austin,,JuniorHigh,O Henry,,Middle,,,2020-04-06T12:26:14.000Z,2017-10-20T03:35:17.000Z,2020-04-07T04:58:49.000Z,2020-04-07T04:58:49.000Z,,,37972,5288
TX,4.42,0,3.82,0,3.96,0,,Keller Williams Realty International,1969,,1080,,2325283,TX,Travis,-97.68065643,78721,http://photos.listhub.net/KW/10712842/1?lm=20191031T002813,http://photos.listhub.net/KW/10712842/1?lm=20191031T002813,100,100,.,5243,7546835,0.971276,1555.95,3219.1,4.7004,4.7004,0.971276,161,,,United States,https://9ac82074a42d61a93c2a-4910baab8d3df1a59178432e0b86512c.ssl.cf5.rackcdn.com,Austin,241111,78.24,30.257532,,"$241,111 ",FALSE,78.24,Johnston Terrace,271442,TX,-97.683629,40,75,3,Single Family Residential,Residential,Single Family Detached,3,,,Active,Austin,MLS Listing,30.26144981,"Fantastic investment opportunity in Johnston Terrace .22 acre lot. Long term tenants/ currently on a month to month lease and are willing to renew. ZONED SF-3 -Rent is est. $1,200/month. Home is on a quiet street. Laminate flooring with open living and dining. Convenient to major highways and 182 project!",,,"Single Family Detached, Other - Austin, TX",,,,,1120 Gardner RD,,,Keller Williams Realty International,(512) 448-4111,http://www.kwaustin.com/,https://listings.listhub.net/pages/KW/10712842/?channel=mashv,2,TRUE,Johnston Terrace,,295000,273.1481481,,0,,,FALSE,2019-10-29T00:00:00.000Z,Central Furnace,Central A/C,"Keller Williams Realty, Inc.",,1,74.12,,City,,Other,,,0,0,0,Elementary,Jordan,,High,Eastside Memorial,,JuniorHigh,Garcia,,Middle,,,2020-04-01T12:25:52.000Z,2019-11-01T08:37:20.000Z,2020-04-07T04:48:23.000Z,2020-04-07T04:48:23.000Z,,,219704,5288
TX,4.42,0,3.82,0,3.96,0,,Keller Williams - Austin Northwest,2018,,975,,2502444,TX,Travis,-97.67932129,78721,http://photos.listhub.net/KW/10914461/1?lm=20200305T005613,http://photos.listhub.net/KW/10914461/1?lm=20200305T005613,100,100,.,4265,5496008,-0.0653889,1180,1658.82,0.319566,0.319566,-0.0653889,35,,,United States,,Austin,360000,67.06,30.282848,,"$360,000 ",FALSE,67.06,MLK 183,276459,TX,-97.673936,21,38,1,Single Family Residential,Residential,Single Family Detached,2,,,Pending,Austin,MLS Listing,30.27154922,"Trendy E Austin neighborhood! Close enough to downtown to enjoy urban vibe with a wooded lot that offers relaxation & privacy. Custom finishes throughout and deep private backyard space. Residents in this revitalized area can bike downtown or catch live music at the Sahara Lounge at the end of the street. Whole Foods & Palomino coffee shop coming soon, new development building up all around. Don&apos;t miss out on this home!脗聽脗聽Near Mueller shopping, coffee, nightlife, Springdale Park, 183, ABIA and downtown.",,,"Single Family Detached, Other - Austin, TX",,,,Carport,1102 Delano ST #B,,,Keller Williams - Austin Northwest,5123463550,,https://listings.listhub.net/pages/KW/10914461/?channel=mashv,2,TRUE,MLK 183,,360000,369.2307692,,0,,,FALSE,2020-03-03T00:00:00.000Z,,,"Keller Williams Realty, Inc.",,1,84.6,,,,Other,,,0,0,0,Elementary,Sims,,High,Lyndon B Johnson (Austin ISD),,JuniorHigh,Garcia,,Middle,,,2020-04-01T12:28:13.000Z,2020-03-06T04:14:56.000Z,2020-04-07T04:38:39.000Z,2020-04-07T04:38:39.000Z,,,365675,7994
TX,4.42,0,3.82,0,3.96,0,,Keller Williams - Austin Northwest,2019,4:00 PM,1425,,2404351,TX,Travis,-97.68005371,78721,http://photos.listhub.net/KW/10808149/1?lm=20200325T125538,http://photos.listhub.net/KW/10808149/1?lm=20200325T125538,100,100,.,2663,5112360,0.626714,1438.07,2420.15,2.06284,2.06284,0.626714,92,,,United States,,Austin,360000,67.06,30.282848,,"$360,000 ",FALSE,67.06,MLK 183,276459,TX,-97.673936,21,38,1,Condo/Coop,Common Interest,Condominium,3,,,Active,Austin,MLS Listing,30.27924919,NEW Home with tons of natural lights and upgrades thru out the entire home. AMAZING appliance packet includes refrigerator all high end Bertazzoni Italia. Centrally located with major highways near for quick commute.,3/8/2020,,"Condominium, Other - Austin, TX",,,,,1404 Meander DR #B,12:00 PM,,Keller Williams - Austin Northwest,5123463550,,https://listings.listhub.net/pages/KW/10808149/?channel=mashv,3,TRUE,MLK 183,,449999,315.7887719,,0,,,FALSE,2020-01-06T00:00:00.000Z,Central Furnace,Central A/C,"Keller Williams Realty, Inc.",,1,52.42,,,,Other,,,0,0,0,Elementary,Sims,,High,Eastside Memorial,,JuniorHigh,Garcia,,Middle,,,2020-04-06T12:28:56.000Z,2020-01-08T02:15:53.000Z,2020-04-07T04:37:11.000Z,2020-04-07T04:37:11.000Z,,,98960,7994
TX,4.42,0,3.82,0,3.96,0,,Keller Williams - Austin Northwest,1972,,1021,,2535450,TX,Travis,-97.68276215,78721,http://photos.listhub.net/KW/10950565/1?lm=20200321T125224,http://photos.listhub.net/KW/10950565/1?lm=20200321T125224,100,100,https://mls.dev1.realtour.biz/6113CalmarCove/Austin/TX,3956,9522166,1.29253,1555.95,3219.1,5.1479,5.1479,1.29253,19,,,United States,https://9ac82074a42d61a93c2a-4910baab8d3df1a59178432e0b86512c.ssl.cf5.rackcdn.com,Austin,241111,78.24,30.257532,,"$241,111 ",FALSE,78.24,Johnston Terrace,271442,TX,-97.683629,40,75,3,Single Family Residential,Residential,Single Family Detached,3,,,Active,Austin,MLS Listing,30.25588036,"Conv. located just mins from DT in the scorching hot 78721. Awesome unprecedented value on .24-acre cul-de-sac lot that backs to green space. New construction next door & many new construction communities w/in blocks of home. Easy access to 183. Perfect lot for builder or remodelers dream to work w/in rapidly growing up-&-coming area. Owner added add&apos;l walls in one of living/flex spaces so it can be an add&apos;l private space along w/new carpet in the flex room, 2 rooms and hallway.",,,"Single Family Detached, Other - Austin, TX",,,,Covered,6113 Calmar CV,,,Keller Williams - Austin Northwest,5123463550,,https://listings.listhub.net/pages/KW/10950565/?channel=mashv,1,TRUE,Johnston Terrace,,309800,303.4280118,,0,,,FALSE,2020-03-19T00:00:00.000Z,Central Furnace,Central A/C,"Keller Williams Realty, Inc.",,1,92.8,,,,Other,,,0,0,0,Elementary,Govalle,,High,Eastside Memorial,,JuniorHigh,Martin,,Middle,,,2020-04-06T12:28:56.000Z,2020-03-22T03:19:26.000Z,2020-04-07T04:39:37.000Z,2020-04-07T04:39:37.000Z,,,37715,7994
TX,4.42,0,3.82,0,3.96,0,,Keller Williams - Austin Northwest,1952,,1600,,2549137,TX,Travis,-97.71138,78722,http://photos.listhub.net/KW/10967341/1?lm=20200331T130306,http://photos.listhub.net/KW/10967341/1?lm=20200331T130306,100,100,https://my.matterport.com/show/?m=1BFFfZBav7m&mls=1,6375,6376654,1.08961,1810,3497.92,5.08538,5.08538,1.08961,8,,,United States,https://9ac82074a42d61a93c2a-4910baab8d3df1a59178432e0b86512c.ssl.cf5.rackcdn.com,Austin,604950,67.88,30.292212,,"$604,950 ",FALSE,67.88,Upper Boggy Creek,271616,TX,-97.716317,67,39,4,Single Family Residential,Residential,Single Family Detached,3,,,Pending,Austin,MLS Listing,30.28838921,"A Cherrywood opportunity for an investor or owner occupant (see agent for more details on renovation loans to personalize and make this your dream home!). This Central Austin home is minutes to downtown & the UT Campus. Home has some pre-construction done and materials ready for updating. Will be sold ""as is."" Close to the popular local attractions, including Cherrywood Coffeehouse & Boggy Creek Park trails. 3D Virtual Walk-Thru. https://my.matterport.com/show/?m=1BFFfZBav7m&play=1 buyer to verify SF.",,,"Single Family Detached, Other - Austin, TX",,,,Off Street,3509 Vineland DR,,,Keller Williams - Austin Northwest,5123463550,,https://listings.listhub.net/pages/KW/10967341/?channel=mashv,2,TRUE,Upper Boggy Creek,,335000,209.375,,0,,,FALSE,2020-03-30T00:00:00.000Z,Central Furnace,Central A/C,"Keller Williams Realty, Inc.",,1,100,,,,Other,,,0,0,0,Elementary,Maplewood,,High,McCallum,,JuniorHigh,Kealing,,Middle,,,2020-04-06T12:28:56.000Z,2020-04-01T04:41:36.000Z,2020-04-07T04:39:58.000Z,2020-04-07T04:39:58.000Z,,,37681,7994
TX,4.42,0,3.82,0,3.96,0,,Keller Williams Realty International,1961,,1536,,2034605,TX,Travis,-97.64369965,78724,http://photos.listhub.net/KW/10614931/1?lm=20190911T183239,http://photos.listhub.net/KW/10614931/1?lm=20190911T183239,100,100,http://5208rogerslane.eproptour.com,3298,7652775,3.28624,1880,2888.16,6.16081,6.16081,3.28624,210,,,United States,,Austin,360000,67.06,30.282848,,"$360,000 ",FALSE,67.06,MLK 183,276459,TX,-97.673936,21,38,1,Single Family Residential,Residential,Single Family Detached,4,0,,Active,Austin,MLS Listing,30.28009987,"Duplex style home. Both lot # 3 & #4 sold together, total acreage of combined lots per realist is 0.571. Lot 3 is 5206 Rogers Ln, see MLS#8481300. Duplex located on lot#4 sold in as-is condition and possible tear down. Shed conveys. Great location, close to Walter E Long Lake & Metropolitan Park. Less than 20 minutes to downtown Austin. Easy access to 130 TOLL & short drive to Airport.",,,"Single Family Detached, Other - Austin, TX",,,,Carport,5208 Rogers LN,,14810,Keller Williams Realty International,(512) 448-4111,http://www.kwaustin.com/,https://listings.listhub.net/pages/KW/10614931/?channel=mashv,2,TRUE,MLK 183,,250000,162.7604167,,0,,Assumed Owner Occupancy,TRUE,2019-09-10T00:00:00.000Z,Central Furnace,Central A/C,"Keller Williams Realty, Inc.",27,1,72.25,,,,Other,,,0,0,0,Elementary,Oak Meadows,,High,Manor,,JuniorHigh,Decker,,Middle,,,2020-04-06T12:26:14.000Z,2019-07-14T01:21:51.000Z,2020-04-07T04:47:34.000Z,2020-04-07T04:47:34.000Z,LEIHEGE MELISSA,K,37983,5288
TX,4.42,0,3.82,0,3.96,0,,Keller Williams Realty International,1963,,480,,448434,TX,Travis,-97.68309021,78721,http://photos.listhub.net/KW/10298684/1?lm=20190427T123910,http://photos.listhub.net/KW/10298684/1?lm=20190427T123910,100,100,.,4432,6396892,-0.163063,1838.85,2292,-0.124724,-0.124724,-0.163063,347,views,20,United States,https://9ac82074a42d61a93c2a-4910baab8d3df1a59178432e0b86512c.ssl.cf5.rackcdn.com,Austin,625000,66.02,30.281887,,"$625,000 ",FALSE,66.02,MLK,271474,TX,-97.692572,25,98,2,Single Family Residential,Residential,Single Family Detached,2,,,Active,Austin,MLS Listing,30.27359962,"DEVELOPMENT OPPORTUNITY IN EAST AUSTIN!! Value is in the land! 1.23 acres in East Austin. Hilltop, flat lot with possible downtown views. House is a teardown. Quiet neighborhood 3.5 miles to UT. Minutes to 183 Access. Horses on Property. Back of lot can be viewed from 5215 Star Light Terrace. DRONE VIDEO IN TOUR LINKS.",,,"Single Family Detached, Other - Austin, TX",,,,,5205 Delores AVE,,,Keller Williams Realty International,(512) 448-4111,http://www.kwaustin.com/,https://listings.listhub.net/pages/KW/10298684/?channel=mashv,1,TRUE,MLK,,1100000,2291.666667,,0,,,FALSE,2019-04-26T00:00:00.000Z,,,"Keller Williams Realty, Inc.",,1,82,,City,,Other,,,0,0,0,Elementary,Sims,,High,Reagan,,JuniorHigh,Garcia,,Middle,,,2020-04-06T12:26:14.000Z,2017-02-27T04:41:33.000Z,2020-04-07T04:45:20.000Z,2020-04-07T04:45:20.000Z,,,38263,5288
TX,4.42,0,3.82,0,3.96,0,,Keller Williams - Austin Northwest,2019,4:00 PM,1425,,2402740,TX,Travis,-97.68005371,78721,http://photos.listhub.net/KW/10806002/1?lm=20200325T125806,http://photos.listhub.net/KW/10806002/1?lm=20200325T125806,100,100,.,2663,1527711,0.626714,1438.07,2420.15,2.06284,2.06284,0.626714,94,,,United States,,Austin,360000,67.06,30.282848,,"$360,000 ",FALSE,67.06,MLK 183,276459,TX,-97.673936,21,38,1,Condo/Coop,Common Interest,Condominium,3,,,Active,Austin,MLS Listing,30.27924919,NEW Home with tons of natural lights and upgrades thru out the entire home. AMAZING appliance packet includes refrigerator all high end Bertazzoni Italia. Centrally located with major highways near for quick commute.,3/8/2020,,"Condominium, Other - Austin, TX",,,,,1404 Meander DR #A,12:00 PM,10533,Keller Williams - Austin Northwest,5123463550,,https://listings.listhub.net/pages/KW/10806002/?channel=mashv,3,TRUE,MLK 183,,449999,315.7887719,,0,,,FALSE,2020-01-04T00:00:00.000Z,,Central A/C,"Keller Williams Realty, Inc.",,1,52.42,,,,Other,,,0,0,0,Elementary,Sims,,High,Eastside Memorial,,JuniorHigh,Garcia,,Middle,,,2020-04-06T12:28:56.000Z,2020-01-06T02:14:43.000Z,2020-04-07T04:37:07.000Z,2020-04-07T04:37:07.000Z,MJC GROUP,LLC,98960,7994
TX,4.42,0,3.82,0,3.96,0,,Martindale Real Estate Investments,,,2046,,1891583,TX,Travis,-97.69748688,77663,http://photos.listhub.net/BBORTX/204484/1?lm=20190601T184648,http://photos.listhub.net/BBORTX/204484/1?lm=20190601T184648,100,100,.,2600,204484,3.25606,1414.5,2452.09,6.8551,6.8551,3.25606,,,,United States,,Austin,304450,67.89,30.3683,,"$304,450 ",FALSE,67.89,North Austin,274685,TX,-97.705015,53,27,1,Single Family Residential,Residential,Single Family Detached,3,,,Active,Austin,MLS Listing,30.36885071,"3/2/2 BRICK HOME THAT WAS COMPLETLY REMODELED IN 2018.  LOCATED ON A LARGE LOT.  WOOD BURNING FIREPLACE, SPECIAL CEILING IN LIVING AREA, KITCHEN HAS A GAS STOVE WITH NEW CABINETS, BREAKFAST BAR, DISHWASHER, MASTER BATH HAS LARGE WALK-IN SHOWER,  LARGE SUN PORCH.  THE BACK YARD IS FENCED.  CALL TODAY FOR SHOWING!",,,"Single Family - Village Mills, TX",,,2,Garage - Attached,100 E BLACKGUM LANE,,8712,Martindale Real Estate Investments,(409) 283-8727,https://www.martindalerealestate.com,https://listings.listhub.net/pages/BBORTX/204484/?channel=mashv,2,TRUE,North Austin,,164900,80.59628543,,0,,Assumed Owner Occupancy,TRUE,,Fireplace (Electric),Central A/C,Beaumont Board - Southeast Texas MLS,,1,81.83,12.5,,,Other,,,0,0,0,Elementary,,Warren,High,,Warren,JuniorHigh,,Warren,Middle,,Warren,2020-03-30T22:41:21.000Z,2019-06-10T00:43:28.000Z,2020-04-06T05:58:07.000Z,2020-04-06T05:58:07.000Z,MATTHEW,PETRAUKAS,203646,32629
TX,4.42,0,3.82,0,3.96,0,,Keller Williams - Austin Northwest,1968,,1344,,2530642,TX,Travis,-97.71221924,78758,http://photos.listhub.net/KW/10945265/1?lm=20200328T184741,http://photos.listhub.net/KW/10945265/1?lm=20200328T184741,100,100,.,5628,2563163,0.758797,1730,2946.36,2.73103,2.73103,0.758797,20,,,United States,https://9ac82074a42d61a93c2a-4910baab8d3df1a59178432e0b86512c.ssl.cf5.rackcdn.com,Austin,514900,67.18,30.360407,,"$514,900 ",FALSE,67.18,Wooten,271665,TX,-97.721742,67,26,0,Single Family Residential,Residential,Single Family Detached,3,,,Pending,Austin,MLS Listing,30.36034012,"Gorgeous home nestled among the trees, right off of N Lamar! Home features beautiful design elements throughout, galley kitchen with bright backsplash, stainless steel appliances, built in bookcases, steam shower and modern finishes in the bathrooms. Backyard with privacy fence is the perfect spot for entertaining friends and family. Close to major highways and tons of shopping and restaurants!",,,"Single Family Detached, Other - Austin, TX",,,,Open,8604 Brookfield DR,,,Keller Williams - Austin Northwest,5123463550,,https://listings.listhub.net/pages/KW/10945265/?channel=mashv,2,TRUE,Wooten,,399000,296.875,,0,,,FALSE,2020-03-18T00:00:00.000Z,Central Furnace (Natural Gas),Central A/C,"Keller Williams Realty, Inc.",,1,100,,,,Other,,,0,0,0,Elementary,Wooten,,High,Lanier,,JuniorHigh,Burnet (Austin ISD),,Middle,,,2020-04-06T12:28:56.000Z,2020-03-20T04:47:29.000Z,2020-04-07T04:39:07.000Z,2020-04-07T04:39:07.000Z,,,99703,7994
TX,4.42,0,3.82,0,3.96,0,,Keller Williams - Austin Northwest,1973,,1985,,2493908,TX,Travis,-97.68617249,78753,http://photos.listhub.net/KW/10906311/1?lm=20200229T124853,http://photos.listhub.net/KW/10906311/1?lm=20200229T124853,100,100,https://www.seetheproperty.com/u/340005,2929,6180299,3.24158,1673.82,629.828,-1.62257,-1.62257,3.24158,39,,,United States,,Austin,291000,67.38,30.345505,,"$291,000 ",FALSE,67.38,Heritage Hills,271422,TX,-97.688038,36,18,1,Condo/Coop,Common Interest,Condominium,4,,,Pending,Austin,MLS Listing,30.35305023,Pristine Condo newly painted w/no carpet boasts 4 beds w/2 walk-in closets~walkout balcony~3 full bath~Well-designed layout offers large living room w/cozy fireplace~Bright & spacious kitchen provides a delightful dining area~ample cabinetry~wide countertops~New windows & Sliding glass doors for a fresh look~Newly installed private patio fence~2 Covered parking spots~Add&apos;l parking available for guests & residents & easy access to pool & tennis court. Open back patio w/shaded trees great for entertaining.,,,"Condominium, Other - Austin, TX",,,,Carport,9009 North PLZ #131,,,Keller Williams - Austin Northwest,5123463550,,https://listings.listhub.net/pages/KW/10906311/?channel=mashv,3,TRUE,Heritage Hills,,217000,109.3198992,,0,,,FALSE,2020-02-28T00:00:00.000Z,Central Furnace,Central A/C,"Keller Williams Realty, Inc.",,1,76.31,,,,Other,,,0,0,0,Elementary,Hart,,High,Reagan,,JuniorHigh,Dobie (Austin ISD),,Middle,,,2020-04-06T12:28:56.000Z,2020-03-01T04:06:36.000Z,2020-04-07T04:38:18.000Z,2020-04-07T04:38:18.000Z,,,37772,7994
TX,4.42,0,3.82,0,3.96,0,,Keller Williams - Austin Northwest,1964,,1650,,2362420,TX,Travis,-97.69927216,78753,http://photos.listhub.net/KW/10758841/1?lm=20191201T183547,http://photos.listhub.net/KW/10758841/1?lm=20191201T183547,100,100,.,3339,1852370,1.43262,1603.1,2454.62,2.04392,2.04392,1.43262,136,,,United States,https://9ac82074a42d61a93c2a-4910baab8d3df1a59178432e0b86512c.ssl.cf5.rackcdn.com,Austin,342000,75.91,30.351274,,"$342,000 ",FALSE,75.91,Georgian Acres,271398,TX,-97.700336,54,14,2,Single Family Residential,Residential,Single Family Detached,3,,,Pending,Austin,MLS Listing,30.35627937,"Amazing Home with Updates that include: Roof, Stucco and Stone Siding, Front and Back Porch with Columns, HVAC, Ducts, Kitchen, Bathrooms, Flooring, Insulation in Attic, Cabinets, Counter Tops ~ Up and Coming area close to the Domain ~ One of the Bedrooms doesn&apos;t have Closet ~ Covered Patio wired for TV and Speakers + Fireplace, Grill, Playscape, Tree house ~ Carport for 3 cars ~ Storage in Back ~ Located at the End of the Cul-De-Sac behind Iron Fencing and Gate ~ Low Tax Rate",,,"Single Family Detached, Other - Austin, TX",,,,Carport,504 Oakley CT,,,Keller Williams - Austin Northwest,5123463550,,https://listings.listhub.net/pages/KW/10758841/?channel=mashv,2,TRUE,Georgian Acres,,335000,203.030303,,0,,,FALSE,2019-11-23T00:00:00.000Z,Central Furnace,Central A/C,"Keller Williams Realty, Inc.",,1,90.27,,,,Other,,,0,0,0,Elementary,Barrington,,High,Lanier,,JuniorHigh,Webb,,Middle,,,2020-03-30T12:38:23.000Z,2019-11-25T03:48:00.000Z,2020-04-07T04:36:49.000Z,2020-04-07T04:36:49.000Z,,,37757,7994
TX,4.42,0,3.82,0,3.96,0,,Keller Williams - Austin Northwest,1949,,1596,,2507426,TX,Travis,-97.69513702,78753,http://photos.listhub.net/KW/10923960/1?lm=20200307T183344,http://photos.listhub.net/KW/10923960/1?lm=20200307T183344,100,100,http://listing.austin360photography.com/ut/102_W_Fawnridge.html,4937,8106432,1.65301,1900,4519.99,7.95052,7.95052,1.65301,32,,,United States,https://9ac82074a42d61a93c2a-4910baab8d3df1a59178432e0b86512c.ssl.cf5.rackcdn.com,Austin,342000,75.91,30.351274,,"$342,000 ",FALSE,75.91,Georgian Acres,271398,TX,-97.700336,54,14,2,Single Family Residential,Residential,Single Family Detached,4,,,Pending,Austin,MLS Listing,30.35872078,"This house located in the 78753 area code is one you can&apos;t miss! Unique wood and concrete walls provide texture throughout the space. The white kitchen provides a bright and clean feel, and is an absolutely gorgeous contrast with the wood walls. The large yard is definitely one of the key elements of this house as there is plenty of space for entertaining, to build a garden - planting whatever you desire! With a short commute to Downtown Austin or The Domain - You will always find something to do!",,,"Single Family Detached, Other - Austin, TX",,,,,102 W Fawnridge DR,,,Keller Williams - Austin Northwest,5123463550,,https://listings.listhub.net/pages/KW/10923960/?channel=mashv,4,TRUE,Georgian Acres,,349000,218.6716792,,0,,,FALSE,2020-03-06T00:00:00.000Z,Central Furnace,Central A/C,"Keller Williams Realty, Inc.",,1,85.25,,,,Other,,,0,0,0,Elementary,Barrington,,High,Lanier,,JuniorHigh,Webb,,Middle,,,2020-04-06T12:28:56.000Z,2020-03-08T04:32:41.000Z,2020-04-07T04:38:47.000Z,2020-04-07T04:38:47.000Z,,,206945,7994
TX,4.42,0,3.82,0,3.96,0,,RE/MAX Legends,1979,,1631,,2481906,TX,Travis,-97.673172,78754,http://photos.listhub.net/SMABOR/402915/1?lm=20200222T060442,http://photos.listhub.net/SMABOR/402915/1?lm=20200222T060442,100,100,.,,402915,0.0877671,1570,4524.68,6.42028,6.42028,0.0877671,46,,,United States,,Austin,291000,67.38,30.345505,,"$291,000 ",FALSE,67.38,Heritage Hills,271422,TX,-97.688038,36,18,1,Single Family Residential,Residential,Single Family Detached,3,,,Pending,Austin,MLS Listing,30.34267998,"Great custom built home with stone and siding - in a great location. Small established neighborhood, 7-10 miles from downtown Austin. 3/2/2 plus formal dining room, metal roof, private front patio, enclosed covered back patio, double car port, completely fenced with 4800. in new chain link, gates, and some wooden privacy fence. Loving care given to keep established trees and landscaping trimmed and healthy - all on over a third of an acre! Brand new kitchen and bathroom flooring, new faucets in bathroom and kitchen, new garbage disposal, newer range - oven never used, lots of cabinets and counter space, vintage lighting! Beautiful floor to ceiling stone fireplace in the great room. This home is a diamond in the rough with reduction already applied to be sold in AS- IS condition for conventional loan or cash. Must see and it won't last long! Make your appt through showing time.",,,"Craftsman, Single Family - Austin, TX",,,,,1807 Future Drive,,15655,RE/MAX Legends,(254) 947-3361,http://www.remaxlegendstx.com,https://listings.listhub.net/pages/SMABOR/402915/?channel=mashv,2,TRUE,Heritage Hills,,365000,223.7890865,,0,,,FALSE,2020-02-21T00:00:00.000Z,Fireplace (Electric),Central A/C,Central Texas Multiple Listing Service,,1,90.94,,,238532,Craftsman,,,0,0,0,Elementary,,Manor ISD,High,,Manor ISD,JuniorHigh,,Manor ISD,Middle,,Manor ISD,2020-03-01T05:08:57.000Z,2020-02-23T08:46:55.000Z,2020-04-07T05:02:30.000Z,2020-04-07T05:02:30.000Z,,,394787,139
TX,4.42,0,3.82,0,3.96,0,,Keller Williams - Austin Northwest,1984,,1588,,2483192,TX,Travis,-97.66526031,78754,http://photos.listhub.net/KW/10895986/1?lm=20200224T124344,http://photos.listhub.net/KW/10895986/1?lm=20200224T124344,100,100,.,5282,6013497,1.3701,1650.25,5143.97,11.5764,11.5764,1.3701,42,,,United States,,Austin,299997,79.34,30.363987,,"$299,997 ",FALSE,79.34,Windsor Hills,271651,TX,-97.676954,41,9,11,Single Family Residential,Residential,Single Family Detached,3,,,Pending,Austin,MLS Listing,30.37100983,"Superbly maintained 1 story home. Formal exterior entry to the home leading into the spacious living room with vaulted ceilings & white brick wood burning fireplace. Eco friendly bamboo flooring throughout much of the home. Large dining area & kitchen with stainless appliances including refrigerator, double oven range, microwave/hood & dishwasher. Pantry & laundry room lead to the garage with workshop area - benches included! All 3 spacious bedrooms have walk in closets! Large yard & garden shed too!",,,"Single Family Detached, Other - Austin, TX",,,,Garage - Attached,11208 Bluff Canyon DR,,10088,Keller Williams - Austin Northwest,5123463550,,https://listings.listhub.net/pages/KW/10895986/?channel=mashv,2,TRUE,Windsor Hills,,280000,176.3224181,,0,,,FALSE,2020-02-23T00:00:00.000Z,Central Furnace,Central A/C,"Keller Williams Realty, Inc.",,1,81.12,,,,Other,,,0,0,0,Elementary,Pioneer Crossing,,High,Manor,,JuniorHigh,Decker,,Middle,,,2020-03-21T12:30:09.000Z,2020-02-25T02:38:14.000Z,2020-04-05T04:36:51.000Z,2020-04-05T04:36:51.000Z,ARCHER RENA,M,205706,7994
