TX,4.42,0,3.82,0,3.96,0,,Keller Williams - Austin Northwest,1971,,852,,2363040,TX,Travis,-97.73428345,78705,http://photos.listhub.net/KW/10759294/1?lm=20191125T124437,http://photos.listhub.net/KW/10759294/1?lm=20191125T124437,100,100,https://comeandshootitphotography.gofullframe.com/ut/400_W_35th_207.html,4819,2165271,0.410077,1320.2,2833.14,3.93043,3.93043,0.410077,135,,,United States,https://9ac82074a42d61a93c2a-4910baab8d3df1a59178432e0b86512c.ssl.cf5.rackcdn.com,Austin,290000,68.3,30.296868,North University is one of the more popular areas in Austin. The neighborhood is ranked #27 in Austin and #186 in all of Texas. Some amenities include Congress Avenue Kayaks and Art.Science.Gallery. The cost of living is higher but the area has high graduation rates and a stable housing market.,"$290,000 ",FALSE,68.3,North University,271501,TX,-97.73633,84,205,2,Condo/Coop,Common Interest,Condominium,2,,,Active,Austin,MLS Listing,30.30009079,"Updated 2/2 condo in the North UT/Hyde Park area - a great location reflecting the charm, weirdness, and true character of Austin. Quiet end unit with no shared walls. Private gated patio, perfect for dog owners; Adams-Hemphill park just 2 blocks away. Updates include dishwasher, HVAC, extra vents, and ductwork. Wood and tile floors. Combo washer/dryer in unit. Building exterior remodeled in 2016 - new roof, exterior siding and paint, landscaping, insulation, and windows. HOA fees cover water/sewer/trash.",,,"Condominium, Other - Austin, TX",,,,,400 W 35th ST #207,,,Keller Williams - Austin Northwest,5123463550,,https://listings.listhub.net/pages/KW/10759294/?channel=mashv,2,TRUE,North University,,290000,340.3755869,,0,,,FALSE,2019-11-24T00:00:00.000Z,Central Furnace,Central A/C,"Keller Williams Realty, Inc.",,1,50,,,,Other,,,0,0,0,Elementary,Lee,,High,McCallum,,JuniorHigh,Kealing,,Middle,,,2020-04-06T12:28:56.000Z,2019-11-26T04:01:57.000Z,2020-04-07T04:36:52.000Z,2020-04-07T04:36:52.000Z,,,68070,7994
TX,4.42,0,3.82,0,3.96,0,,Compass,1959,,1394,,2495216,TX,Travis,-97.7514801,78705,http://photos.listhub.net/CLAWCA/20-558986/1?lm=20200306T230758,http://photos.listhub.net/CLAWCA/20-558986/1?lm=20200306T230758,100,100,.,,20-558986,0.261261,3583.4,2972.93,-0.888413,-0.888413,0.261261,40,,,United States,https://9ac82074a42d61a93c2a-4910baab8d3df1a59178432e0b86512c.ssl.cf5.rackcdn.com,Austin,1395000,66.12,30.294407,,"$1,395,000 ",FALSE,66.12,Windsor Road,271653,TX,-97.753689,33,184,3,Condo/Coop,Residential,Condominium,2,,,Active,Austin,MLS Listing,30.28517914,"Hidden on a quiet residential street eight blocks from the University of Texas, this important work by the award-winning mid-century modern architect is recognized as a historic landmark at city, state, and national levels. Organized around a majestic live oak at the center of a courtyard, the intimate complex is a serene environment seemingly removed from the busy outside world. Inside, the double-height living space is complimented by an open mezzanine bedroom above and a kitchen/dining area tucked below, connecting seamlessly to the bamboo forest beyond the two-story glass wall. Original appointments have been well preserved, including ergonomic cabinetry, redwood siding, original paint colors, and decorative light fixtures. Architects Ernesto Cragnolino of Alterstudio and Krista Whitson of Mell Lawrence Architects renovated the home respectfully, installing hardwood floors to match original specifications, creating a second master suite with luxurious bath finishes, and upgrading the kitchen with high-end stainless steel appliances. This special offering is a fine example of architecture in harmony with its context, melding formal Modernist principles with the landscape, climate, and materials of the region. Reduced property taxes.",,,"Condominium, Mid Century - Other, TX",,,2,Assigned,1911 CLIFF Street #3,,,Compass,,https://www.compass.com/,https://listings.listhub.net/pages/CLAWCA/20-558986/?channel=mashv,2,TRUE,Windsor Road,,770000,552.3672884,,0,,,FALSE,2020-02-27T00:00:00.000Z,Central Furnace,Central A/C,"Combined LA Westside Multiple Listing Service, Inc",,0,4.04,384.5,,712015,Other,,,0,0,0,.,.,.,.,.,.,.,.,.,.,.,.,2020-04-01T22:52:11.000Z,2020-03-02T03:19:04.000Z,2020-04-07T03:46:21.000Z,2020-04-07T03:46:21.000Z,,,85408,801
TX,4.42,0,3.82,0,3.96,0,,RE/Max Capital City,1971,,557,5/4/2017 0:00,2363094,TX,Travis,-97.73428345,78705,http://photos.listhub.net/SMABOR/396518/1?lm=20191125T201708,http://photos.listhub.net/SMABOR/396518/1?lm=20191125T201708,100,100,.,3342,396518,,,,,,,127,,,United States,https://9ac82074a42d61a93c2a-4910baab8d3df1a59178432e0b86512c.ssl.cf5.rackcdn.com,Austin,290000,68.3,30.296868,North University is one of the more popular areas in Austin. The neighborhood is ranked #27 in Austin and #186 in all of Texas. Some amenities include Congress Avenue Kayaks and Art.Science.Gallery. The cost of living is higher but the area has high graduation rates and a stable housing market.,"$290,000 ",FALSE,68.3,North University,271501,TX,-97.73633,84,205,2,Condo/Coop,Residential,Condominium,1,,,inactive,Austin,MLS Listing,30.30009079,Enjoy the Austin Lifestyle*Fabulous Location*Only about 3 Minutes from Downtown Austin*2 Blocks to Bus Route*Enjoy Hyde Park Neighborhood Shops & Dining*Quiet 20 Unit Complex*Updated 1 Bedroom & 1 Bath*Kitchen has Granite Tiled Countertops*2 Walk-In Closets in Spacious Master*Subway Tile & Brushed Nickle Fixtures in Bath*Laminate Wood-Look Flooring*Neutral Color Palette*Outdoor Common Area has a B-B-Q Grill,,,"Condominium, Traditional - Austin, TX",,,,,400 W 35th Street #105,,902,RE/Max Capital City,(512) 381-2220,,https://listings.listhub.net/pages/SMABOR/396518/?channel=mashv,1,TRUE,North University,,215000,385.9964093,222400,0,,Assumed Owner Occupancy,TRUE,2019-11-25T00:00:00.000Z,,Central A/C,Central Texas Multiple Listing Service,,1,53.33,155,,739610,New Traditional,,,0,0,0,Elementary,,Austin ISD,High,,Austin ISD,JuniorHigh,,Austin ISD,Middle,,Austin ISD,2020-02-15T18:14:09.000Z,2019-11-26T04:25:54.000Z,2020-03-31T05:15:19.000Z,2020-03-31T05:15:19.000Z,HANDY ARIEL & WILLIAM,CHANDLER,175431,1039
TX,4.42,0,3.82,0,3.96,0,,Keller Williams Realty International,1997,2:00 PM,1040,,2446002,TX,Travis,-97.74250031,78705,http://photos.listhub.net/KW/10853720/1?lm=20200202T122617,http://photos.listhub.net/KW/10853720/1?lm=20200202T122617,100,100,https://tours.virtuance.com/public/vtour/display/1526142?idx=1#!/,6965,9721455,,,,,,,53,,,United States,https://9ac82074a42d61a93c2a-4910baab8d3df1a59178432e0b86512c.ssl.cf5.rackcdn.com,Austin,327450,69.33,30.29314,"&nbsp;As the name indicates, West Campus is a neighborhood close the <a href=""http://www.utexas.edu/"">University of Texas at Austin</a>. The neighborhood has many college students and has one of the highest population densities in Austin. The increase in student population is due to the zoning changes and city initiatives passed in order keep students close to campus and to create an urban environment for students.The neighborhood is well-known for its colorful houses. Due to its location, there are many facilities used by locals and college students such as the <a href=""https://www.google.ps/url?sa=t&amp;rct=j&amp;q=&amp;esrc=s&amp;source=web&amp;cd=1&amp;cad=rja&amp;uact=8&amp;ved=0ahUKEwjWmp2riLHMAhUkLZoKHa9GCPcQFggaMAA&amp;url=http%3A%2F%2Fwww.blantonmuseum.org%2F&amp;usg=AFQjCNH56m1bIIahPbBoP4sYl32-wOFYDA&amp;bvm=bv.120853415,d.bGs"">Blanton Museum of Art</a>, <a href=""http://www.hrc.utexas.edu/"">Harry Ransom Center</a>, and the <a href=""http://www.thestoryoftexas.com/"">Bob Bullock Texas State History Museum</a>. The eastern part of West Campus is a large commercial area, called &ldquo;The Drag,&rdquo; which has restaurants, stores, and venues across the street from the University.The housing found in this neighborhood is very diverse with nearly century-old buildings, modern apartments and condominiums, bungalows, and historical mansions. A lot of these residents are occupied by fraternities and sororities.","$327,450 ",FALSE,69.33,West University,271635,TX,-97.745656,82,206,3,Condo/Coop,Common Interest,Condominium,2,,,inactive,Austin,MLS Listing,30.29005051,"West Campus Condo one block from UT campus. Very walkable location! Great roommate plan with street facing balcony and lots of light. Building amenities include swimming pool, elevator, secure building and 2 reserved garage parking spots.",2/9/2020,,"Condominium, Other - Austin, TX",,,,Garage,501 W 26th ST #219,12:00 PM,797,Keller Williams Realty International,(512) 448-4111,http://www.kwaustin.com/,https://listings.listhub.net/pages/KW/10853720/?channel=mashv,2,TRUE,West University,,369900,355.6730769,,0,,Assumed Owner Occupancy,TRUE,2020-01-31T00:00:00.000Z,Central Furnace,Central A/C,"Keller Williams Realty, Inc.",,0,14.26,,,,Other,TRUE,,0,0,0,Elementary,Bryker Woods,,High,Austin,,JuniorHigh,O Henry,,Middle,,,2020-03-23T12:42:25.000Z,2020-02-02T03:44:18.000Z,2020-03-24T04:49:42.000Z,2020-03-24T04:49:42.000Z,CASTILLO CARMEN & RICHARD  & JULIANA MARIE,HOFT,6331,5288
TX,4.42,0,3.82,0,3.96,0,,RE/MAX Associates of Arlington,1984,,818,,2176708,TX,Travis,-97.75119781,78705,http://photos.listhub.net/NTREIS/14167824/1?lm=20190821T083944,http://photos.listhub.net/NTREIS/14167824/1?lm=20190821T083944,100,100,https://www.propertypanorama.com/instaview/ntreis/14167824,,14167824,,,,,,,,views,1,United States,https://9ac82074a42d61a93c2a-4910baab8d3df1a59178432e0b86512c.ssl.cf5.rackcdn.com,Austin,1395000,66.12,30.294407,,"$1,395,000 ",FALSE,66.12,Windsor Road,271653,TX,-97.753689,33,184,3,Condo/Coop,Residential,Condominium,2,,,inactive,Austin,MLS Listing,30.28949928,"Beautifully Updated 2BD 2Bth in well maintained blding, 5 blocks to UT and ACC campus, on bus lines, 3 min. walk to Pease Park, 15 min. walk to UT Campus, Overlooks Shoal Creek Greenbelt, City Tennis Center 1 block, No Walls shared with neighbors, All electric, 9 food ceilings, wood burning fireplace, ceiling fans, gorgeous porcelain tile and Bamboo wood floors throughout, Newer Stainless Steel appliances, including refrigerator, Large Butcher block countertop with bar area that seats 4, Updated tubs in bathrooms, full size front loading Washer. Dryer. Great for roommates and renters.",,,"RES-Condo - Austin, TX",,,2,Assigned,2414 Longview Street #310,,915,RE/MAX Associates of Arlington,(817) 276-5170,http://www.jodykautz.com/,https://listings.listhub.net/pages/NTREIS/14167824/?channel=mashv,2,TRUE,Windsor Road,,309900,378.8508557,,0,,,FALSE,,Central Furnace,Central A/C,"North Texas Real Estate Information Systems, Inc.",,1,50,215,,206205,Other,,,0,0,0,Elementary,Austin,Austin ISD,High,Austin,Austin ISD,JuniorHigh,Austin,Austin ISD,Middle,,Austin ISD,2020-02-21T20:18:20.000Z,2019-08-22T01:58:18.000Z,2020-03-05T04:30:37.000Z,2020-03-05T04:30:37.000Z,,,86957,5240
TX,4.42,0,3.82,0,3.96,0,,,1946,,1183,3/26/2015 0:03,2452901,TX,Travis,-97.72180176,78705,"https://maps.googleapis.com/maps/api/staticmap?maptype=roadmap&markers=30.2938601,-97.7218015&size=457x331&zoom=15&key=AIzaSyC-Uy0WBXyq4eoFHI0W-fbZdYlxdWIGPSk&center=30.2938601,-97.7218015","https://maps.googleapis.com/maps/api/staticmap?maptype=roadmap&markers=30.2938601,-97.7218015&size=457x331&zoom=15&key=AIzaSyC-Uy0WBXyq4eoFHI0W-fbZdYlxdWIGPSk&center=30.2938601,-97.7218015",100,100,.,7795,107427544,,,,,,,,,,United States,,Austin,232500,67.81,30.296627,"Hancock is a residential neighborhood close to the city center. It is a very desirable place to live in and a great reason to visit Austin. It is also an excellent place to buy rental property.&nbsp;Although close to downtown, you can find many single-family houses with tree-lined streets. It&rsquo;s also close to the University of Texas so it is a great area to live if you attend school or work downtown. There are a lot amenities around with museums, hiking trails, restaurants and nightlife. The Hancock Golf Course is a great place to visit after a long day at work or class!","$232,500 ",FALSE,67.81,Hancock,273924,TX,-97.724996,66,28,1,Single Family Residential,,Single Family Residential,3,,,inactive,Austin,Public Records,30.29385948,,,,,,,,,3504 Harmon Ave,,6861,,,,,2,TRUE,Hancock,,235500,199.0701606,0,0,,,FALSE,,Yes,,,66,1,,,,2.15081E+12,,,,0,0,0,.,.,.,.,.,.,.,.,.,.,.,.,,2020-02-06T19:48:01.000Z,2020-02-06T19:48:01.000Z,2020-02-06T19:48:01.000Z,,,,
TX,4.42,0,3.82,0,3.96,0,,,,,,,2432938,TX,Travis,-97.74562073,78705,"https://maps.googleapis.com/maps/api/staticmap?maptype=roadmap&markers=30.2914327,-97.74561709999999&size=457x331&zoom=15&key=AIzaSyC-Uy0WBXyq4eoFHI0W-fbZdYlxdWIGPSk&center=30.2914327,-97.74561709999999","https://maps.googleapis.com/maps/api/staticmap?maptype=roadmap&markers=30.2914327,-97.74561709999999&size=457x331&zoom=15&key=AIzaSyC-Uy0WBXyq4eoFHI0W-fbZdYlxdWIGPSk&center=30.2914327,-97.74561709999999",100,100,.,,,,,,,,,,,,United States,https://9ac82074a42d61a93c2a-4910baab8d3df1a59178432e0b86512c.ssl.cf5.rackcdn.com,Austin,327450,69.33,30.29314,"&nbsp;As the name indicates, West Campus is a neighborhood close the <a href=""http://www.utexas.edu/"">University of Texas at Austin</a>. The neighborhood has many college students and has one of the highest population densities in Austin. The increase in student population is due to the zoning changes and city initiatives passed in order keep students close to campus and to create an urban environment for students.The neighborhood is well-known for its colorful houses. Due to its location, there are many facilities used by locals and college students such as the <a href=""https://www.google.ps/url?sa=t&amp;rct=j&amp;q=&amp;esrc=s&amp;source=web&amp;cd=1&amp;cad=rja&amp;uact=8&amp;ved=0ahUKEwjWmp2riLHMAhUkLZoKHa9GCPcQFggaMAA&amp;url=http%3A%2F%2Fwww.blantonmuseum.org%2F&amp;usg=AFQjCNH56m1bIIahPbBoP4sYl32-wOFYDA&amp;bvm=bv.120853415,d.bGs"">Blanton Museum of Art</a>, <a href=""http://www.hrc.utexas.edu/"">Harry Ransom Center</a>, and the <a href=""http://www.thestoryoftexas.com/"">Bob Bullock Texas State History Museum</a>. The eastern part of West Campus is a large commercial area, called &ldquo;The Drag,&rdquo; which has restaurants, stores, and venues across the street from the University.The housing found in this neighborhood is very diverse with nearly century-old buildings, modern apartments and condominiums, bungalows, and historical mansions. A lot of these residents are occupied by fraternities and sororities.","$327,450 ",FALSE,69.33,West University,271635,TX,-97.745656,82,206,3,Single Family Residential,,,,,,inactive,Austin,Public Records,30.29143333,,,,,,,,,2606 Salado St,,,,,,,,TRUE,West University,,295000,,,0,,,FALSE,,,,,82,1,,,,,,,,0,0,0,.,.,.,.,.,.,.,.,.,.,.,.,,2020-01-27T05:36:57.000Z,2020-01-27T05:36:57.000Z,2020-01-27T05:36:57.000Z,,,,
TX,4.42,0,3.82,0,3.96,0,,,,,,,2432933,TX,Travis,-97.74555206,78705,"https://maps.googleapis.com/maps/api/staticmap?maptype=roadmap&markers=30.29159319999999,-97.74555339999999&size=457x331&zoom=15&key=AIzaSyC-Uy0WBXyq4eoFHI0W-fbZdYlxdWIGPSk&center=30.29159319999999,-97.74555339999999","https://maps.googleapis.com/maps/api/staticmap?maptype=roadmap&markers=30.29159319999999,-97.74555339999999&size=457x331&zoom=15&key=AIzaSyC-Uy0WBXyq4eoFHI0W-fbZdYlxdWIGPSk&center=30.29159319999999,-97.74555339999999",100,100,.,,,,,,,,,,,,United States,https://9ac82074a42d61a93c2a-4910baab8d3df1a59178432e0b86512c.ssl.cf5.rackcdn.com,Austin,327450,69.33,30.29314,"&nbsp;As the name indicates, West Campus is a neighborhood close the <a href=""http://www.utexas.edu/"">University of Texas at Austin</a>. The neighborhood has many college students and has one of the highest population densities in Austin. The increase in student population is due to the zoning changes and city initiatives passed in order keep students close to campus and to create an urban environment for students.The neighborhood is well-known for its colorful houses. Due to its location, there are many facilities used by locals and college students such as the <a href=""https://www.google.ps/url?sa=t&amp;rct=j&amp;q=&amp;esrc=s&amp;source=web&amp;cd=1&amp;cad=rja&amp;uact=8&amp;ved=0ahUKEwjWmp2riLHMAhUkLZoKHa9GCPcQFggaMAA&amp;url=http%3A%2F%2Fwww.blantonmuseum.org%2F&amp;usg=AFQjCNH56m1bIIahPbBoP4sYl32-wOFYDA&amp;bvm=bv.120853415,d.bGs"">Blanton Museum of Art</a>, <a href=""http://www.hrc.utexas.edu/"">Harry Ransom Center</a>, and the <a href=""http://www.thestoryoftexas.com/"">Bob Bullock Texas State History Museum</a>. The eastern part of West Campus is a large commercial area, called &ldquo;The Drag,&rdquo; which has restaurants, stores, and venues across the street from the University.The housing found in this neighborhood is very diverse with nearly century-old buildings, modern apartments and condominiums, bungalows, and historical mansions. A lot of these residents are occupied by fraternities and sororities.","$327,450 ",FALSE,69.33,West University,271635,TX,-97.745656,82,206,3,Single Family Residential,,,,,,inactive,Austin,Public Records,30.29159355,,,,,,,,,2608 Salado St,,,,,,https://www.redfin.com/TX/Austin/2608-Salado-St-78705/home/31403250?utm_medium=partnership&utm_campaign=redfinestimate&utm_source=mashvisor,,TRUE,West University,,923695,,,0,,,FALSE,,,,,82,1,,,,,,,,0,0,0,.,.,.,.,.,.,.,.,.,.,.,.,,2020-01-27T05:35:30.000Z,2020-01-27T05:35:30.000Z,2020-01-27T05:35:30.000Z,,,,
TX,4.42,0,3.82,0,3.96,0,,Keller Williams Realty International,2006,,720,,2246102,TX,Travis,-97.72540283,78705,http://photos.listhub.net/KW/10638079/1?lm=20191021T164418,http://photos.listhub.net/KW/10638079/1?lm=20191021T164418,100,100,https://www.seetheproperty.com/u/327630,5485,3952354,,,,,,,82,,,United States,,Austin,232500,67.81,30.296627,"Hancock is a residential neighborhood close to the city center. It is a very desirable place to live in and a great reason to visit Austin. It is also an excellent place to buy rental property.&nbsp;Although close to downtown, you can find many single-family houses with tree-lined streets. It&rsquo;s also close to the University of Texas so it is a great area to live if you attend school or work downtown. There are a lot amenities around with museums, hiking trails, restaurants and nightlife. The Hancock Golf Course is a great place to visit after a long day at work or class!","$232,500 ",FALSE,67.81,Hancock,273924,TX,-97.724996,66,28,1,Condo/Coop,Common Interest,Condominium,1,,,inactive,Austin,MLS Listing,30.29210091,"Modern North Campus condominium. Desirable finishes include granite counters, stainless appliances, 10&apos; ceilings throughout, concrete flooring, fresh paint, ceiling fans, double vanity, french doors, stack-able washer and dryer and more. Conveniently located within walking distance to UT, Central Market, restaurants, shopping, Seton Hospital, and more. Don&apos;t miss this one, priced to sell!",,,"Condominium, Other - Austin, TX",,,,,907 Duncan LN #201,,,Keller Williams Realty International,(512) 448-4111,http://www.kwaustin.com/,https://listings.listhub.net/pages/KW/10638079/?channel=mashv,1,TRUE,Hancock,,250000,347.2222222,,0,,,FALSE,2019-09-20T00:00:00.000Z,Central Furnace,Central A/C,"Keller Williams Realty, Inc.",,0,24.77,,City,,Other,,,0,0,0,Elementary,Lee,,High,McCallum,,JuniorHigh,Kealing,,Middle,,,2019-11-26T12:39:15.000Z,2019-09-22T06:36:26.000Z,2019-12-11T02:31:39.000Z,2019-12-11T02:31:39.000Z,,,38170,5288
TX,4.42,0,3.82,0,3.96,0,,Keller Williams - Austin Northwest,2019,3:00 PM,850,,2076365,TX,Travis,-97.73280334,78705,http://photos.listhub.net/KW/10510470/1?lm=20191106T184608,http://photos.listhub.net/KW/10510470/1?lm=20191106T184608,100,100,.,3750,3563696,,,,,,,107,,,United States,https://9ac82074a42d61a93c2a-4910baab8d3df1a59178432e0b86512c.ssl.cf5.rackcdn.com,Austin,290000,68.3,30.296868,North University is one of the more popular areas in Austin. The neighborhood is ranked #27 in Austin and #186 in all of Texas. Some amenities include Congress Avenue Kayaks and Art.Science.Gallery. The cost of living is higher but the area has high graduation rates and a stable housing market.,"$290,000 ",FALSE,68.3,North University,271501,TX,-97.73633,84,205,2,Condo/Coop,Common Interest,Condominium,2,,,inactive,Austin,MLS Listing,30.29710007,"LOCATION, LOCATION, LOCATION! New construction - Haylou Builders. ADU - back unit. Approx 850 sqft. 2/2, 1-story. Contemporary finishes. Hardwoods and hard tile flooring. High ceilings. Est completion date late Aug 2019. Alley access! 1-car carport. Walk to Sparky Park!",8/24/2019,,"Condominium, Other - Austin, TX",,,,Carport,309 E 38 ST #2,1:00 PM,,Keller Williams - Austin Northwest,5123463550,,https://listings.listhub.net/pages/KW/10510470/?channel=mashv,2,TRUE,North University,,424900,499.8823529,,0,,,FALSE,2019-07-23T00:00:00.000Z,Central Furnace,Central A/C,"Keller Williams Realty, Inc.",,1,55.32,,,,Other,,,0,0,0,Elementary,Lee,,High,McCallum,,JuniorHigh,Kealing,,Middle,,,2019-10-21T15:45:07.000Z,2019-07-25T00:53:35.000Z,2019-11-07T07:12:28.000Z,2019-11-07T07:12:28.000Z,,,37763,7994
TX,4.42,0,3.82,0,3.96,0,,Keller Williams Realty International,1928,,2276,,1842262,TX,Travis,-97.73989868,78705,http://photos.listhub.net/KW/10346161/1?lm=20190517T124314,http://photos.listhub.net/KW/10346161/1?lm=20190517T124314,100,100,https://www.seetheproperty.com/r/311697,14928,6725820,,,,,,,161,,,United States,https://9ac82074a42d61a93c2a-4910baab8d3df1a59178432e0b86512c.ssl.cf5.rackcdn.com,Austin,290000,68.3,30.296868,North University is one of the more popular areas in Austin. The neighborhood is ranked #27 in Austin and #186 in all of Texas. Some amenities include Congress Avenue Kayaks and Art.Science.Gallery. The cost of living is higher but the area has high graduation rates and a stable housing market.,"$290,000 ",FALSE,68.3,North University,271501,TX,-97.73633,84,205,2,Single Family Residential,Residential,Single Family Detached,3,,,inactive,Austin,MLS Listing,30.29770088,"Rare opportunity located in historic Aldridge Place. This 3 bedroom/3 bath is full of old-world charm and endless possibilities! Spacious living room offers hardwood floors, formal dining room, built-ins, original moldings, beautiful fireplace are the perfect inspiration! Home offers split bedroom plan, on spacious lot, just walking distance to all things UT campus, Peace Park, trendy restaurant/stores. Possible historical designation, buyer to verify.",,,"Single Family Detached, Other - Austin, TX",,,,,3107 Wheeler ST,,,Keller Williams Realty International,(512) 448-4111,http://www.kwaustin.com/,https://listings.listhub.net/pages/KW/10346161/?channel=mashv,3,TRUE,North University,,750000,329.5254833,,0,,,FALSE,2019-05-16T00:00:00.000Z,Central Furnace,Central A/C,"Keller Williams Realty, Inc.",,1,58.31,,,,Other,,,0,0,0,Elementary,Lee,,High,McCallum,,JuniorHigh,Kealing,,Middle,,,2019-10-21T15:41:31.000Z,2019-05-19T13:41:31.000Z,2019-10-24T08:05:26.000Z,2019-10-24T08:05:26.000Z,,,38219,5288
TX,4.42,0,3.82,0,3.96,0,,Keller Williams - Lake Travis,1984,4:00 PM,813,,1452239,TX,Travis,-97.74590302,78705,http://photos.listhub.net/KW/9919211/1?lm=20181007T124446,http://photos.listhub.net/KW/9919211/1?lm=20181007T124446,100,100,http://www.seetheproperty.com/u/289661,5829,6637013,,,,,,,353,views,19,United States,https://9ac82074a42d61a93c2a-4910baab8d3df1a59178432e0b86512c.ssl.cf5.rackcdn.com,Austin,327450,69.33,30.29314,"&nbsp;As the name indicates, West Campus is a neighborhood close the <a href=""http://www.utexas.edu/"">University of Texas at Austin</a>. The neighborhood has many college students and has one of the highest population densities in Austin. The increase in student population is due to the zoning changes and city initiatives passed in order keep students close to campus and to create an urban environment for students.The neighborhood is well-known for its colorful houses. Due to its location, there are many facilities used by locals and college students such as the <a href=""https://www.google.ps/url?sa=t&amp;rct=j&amp;q=&amp;esrc=s&amp;source=web&amp;cd=1&amp;cad=rja&amp;uact=8&amp;ved=0ahUKEwjWmp2riLHMAhUkLZoKHa9GCPcQFggaMAA&amp;url=http%3A%2F%2Fwww.blantonmuseum.org%2F&amp;usg=AFQjCNH56m1bIIahPbBoP4sYl32-wOFYDA&amp;bvm=bv.120853415,d.bGs"">Blanton Museum of Art</a>, <a href=""http://www.hrc.utexas.edu/"">Harry Ransom Center</a>, and the <a href=""http://www.thestoryoftexas.com/"">Bob Bullock Texas State History Museum</a>. The eastern part of West Campus is a large commercial area, called &ldquo;The Drag,&rdquo; which has restaurants, stores, and venues across the street from the University.The housing found in this neighborhood is very diverse with nearly century-old buildings, modern apartments and condominiums, bungalows, and historical mansions. A lot of these residents are occupied by fraternities and sororities.","$327,450 ",FALSE,69.33,West University,271635,TX,-97.745656,82,206,3,Condo/Coop,Common Interest,Condominium,2,,,inactive,Austin,MLS Listing,30.28440094,,10/28/2018,,,,,,Garage - Attached,704 W 21st ST #101,2:00 PM,,Keller Williams - Lake Travis,5122639090,,https://listings.listhub.net/pages/KW/9919211/?channel=mashv,2,TRUE,West University,,299000,367.7736777,,0,,,FALSE,2018-10-06T00:00:00.000Z,Central Furnace (Natural Gas),Central A/C,"Keller Williams Realty, Inc.",,0,44.87,,,,Other,,,0,0,0,Elementary,Lee,,High,Austin,,JuniorHigh,Small,,Middle,,,2019-09-09T13:11:06.000Z,2018-10-08T01:25:49.000Z,2019-09-24T05:53:29.000Z,2019-09-24T05:53:29.000Z,PRADEEP AVINASH,NAYAK,81114,8145
